{
  "schemaVersion": 1,
  "apiVersion": "1",
  "channel": "development",
  "packages": [
    {
      "id": "sesame/canvas-control",
      "version": "2.1.1",
      "directory": "canvas-control",
      "treeDigest": "sha256:9aba85bb25c50dabed717a260e85dd8d2ca4aa379e46d39e53c90cd54e2ef3f4",
      "files": [
        {
          "path": "LICENSE",
          "sha256": "2681aaf69ad3f8a595707e154e1e065a0077db9f1d25f8f5df73c02c5657477a",
          "bytes": 1063
        },
        {
          "path": "index.js",
          "sha256": "b201e9ffdb3337da815d3b652d75098eac8767fb080ad7bb40713dffc4939419",
          "bytes": 42
        },
        {
          "path": "indicator.js",
          "sha256": "8874a94b04b7d0ecf1a642cef8ce928faed3da0c50bb5d14ee442f7e3d72db58",
          "bytes": 4747
        },
        {
          "path": "market-binding.js",
          "sha256": "02a1c179304a1e8781e0664c6028c9bd870fefee138375ae5136a403ad00e0f4",
          "bytes": 5264
        },
        {
          "path": "package.json",
          "sha256": "454ff8579e462aef25d3a08562c37a6b9ba956098a690e250a5a5e3b892e0811",
          "bytes": 108
        },
        {
          "path": "plugin.json",
          "sha256": "fba73e17e9407627905da9d961166c5ad498b3bf94d5437b05ae011b2d790b95",
          "bytes": 934
        },
        {
          "path": "prompt.md",
          "sha256": "48ab82b5beea63305748399c69fb4fa718f0403d6fb8e7398f6bc0c5687f25a4",
          "bytes": 6784
        },
        {
          "path": "resources/close-line.js",
          "sha256": "46ee968c375357932eb3207f7fd46c8b5e9f6b5ec72b3fe5580a7ee22f7cfaa2",
          "bytes": 401
        },
        {
          "path": "resources/close-line.json",
          "sha256": "9e7ceff9aa9fbc5aafab8ccd8668338737a919497183d14f9b2cddfb697e9b04",
          "bytes": 717
        },
        {
          "path": "skills/market-chart/SKILL.md",
          "sha256": "94f8dc6b0f3d6729ae0cac2d0c572b0103c1be267890e5976b75f1cfa4f76dbd",
          "bytes": 4852
        },
        {
          "path": "tools.js",
          "sha256": "dfd581bf71cb2be49266787f8a173384dea21aced2b32e2067cbc585ac8b7c9d",
          "bytes": 6608
        },
        {
          "path": "tools.json",
          "sha256": "bada9d7132adc1a8a077f449a658f9b7ba5f7c43a1f03f203af2fc81a381caae",
          "bytes": 44653
        }
      ]
    },
    {
      "id": "sesame/configuration",
      "version": "2.0.3",
      "directory": "configuration",
      "treeDigest": "sha256:00648e79430f9cbd8f9d5ab5ab1f839c37c9d9cf53b7c39afe66abbdcb8b219b",
      "files": [
        {
          "path": "LICENSE",
          "sha256": "2681aaf69ad3f8a595707e154e1e065a0077db9f1d25f8f5df73c02c5657477a",
          "bytes": 1063
        },
        {
          "path": "index.js",
          "sha256": "b201e9ffdb3337da815d3b652d75098eac8767fb080ad7bb40713dffc4939419",
          "bytes": 42
        },
        {
          "path": "package.json",
          "sha256": "c3dd7a7fbf5d4f1d4112ff4f964e055a467005e307aecacc9479a24923eb5a0f",
          "bytes": 107
        },
        {
          "path": "plugin.json",
          "sha256": "e30dc88f8dffa3cf90d6f265f25f5c0617ed5e314b3102f912b2ab9ccf5a79fb",
          "bytes": 635
        },
        {
          "path": "prompt.md",
          "sha256": "a24b5fb2ce55b06b0d89b7557f649f73c15ff97a26cfdd3a4da4ec71381a1c53",
          "bytes": 872
        },
        {
          "path": "skills/configure-application/SKILL.md",
          "sha256": "ae0fd22bd2f7c9dc4faf4924384623726a5d1b6425173b37f688c51864e2e218",
          "bytes": 2315
        },
        {
          "path": "support.js",
          "sha256": "cc471c0ce6b82d9ce56a0b1f3bae0bdf416d4e4ab952801f27dc573cba52a509",
          "bytes": 546
        },
        {
          "path": "tools.js",
          "sha256": "6ae3e7bde4ed657468f664e4147c1b5acdeb95fa3959a65ac78ce978c80c0ab9",
          "bytes": 2473
        },
        {
          "path": "tools.json",
          "sha256": "63a0b83e09af768a254abff7c680854688d8f8b4563ebc0095fe7a5186b0db82",
          "bytes": 10477
        }
      ]
    },
    {
      "id": "sesame/data-access",
      "version": "2.3.1",
      "directory": "data-access",
      "treeDigest": "sha256:02cca002efb1e827d388b15c547a294b2bbc2d20d5dfd7789ea6ad2df6365ab2",
      "files": [
        {
          "path": "LICENSE",
          "sha256": "2681aaf69ad3f8a595707e154e1e065a0077db9f1d25f8f5df73c02c5657477a",
          "bytes": 1063
        },
        {
          "path": "data.js",
          "sha256": "46c978a0767efaf12347d410f8dca4dcf0b7d512a7fdb98c06c71a62963234f0",
          "bytes": 2328
        },
        {
          "path": "index.js",
          "sha256": "abd21af1bd163674a9beb12a979662cf3d370fc9791de91315dc2ec73bcb63bc",
          "bytes": 198
        },
        {
          "path": "market-read.js",
          "sha256": "8dc6a41b317e61586912c68f76a2316fd0fac8bb61734a44d2edadbb249fbc64",
          "bytes": 18227
        },
        {
          "path": "market.js",
          "sha256": "0d8895fa7cefa49c38deef5e24580265a5035451dd047b58039b0bdffbb0a56f",
          "bytes": 5569
        },
        {
          "path": "package.json",
          "sha256": "8dd548e248e498e66bfae05add601af69c13ea6b021cfd955088a0fb494a023e",
          "bytes": 105
        },
        {
          "path": "plugin.json",
          "sha256": "c788dac0323b3a8bb72c9c59d1184b0cfc8ec4b6b2abae7fa2b1826b259b0037",
          "bytes": 822
        },
        {
          "path": "prompt.md",
          "sha256": "0b6caf1100c1a4c2ef8207260be301e6e6227afc0a012f5e9394803bc3d71c7f",
          "bytes": 4073
        },
        {
          "path": "research-tools.js",
          "sha256": "41ba6460bfb26e3a34617a263624a0cf6b901e09360517d569be905453d596a2",
          "bytes": 4117
        },
        {
          "path": "skills/analyze-data/SKILL.md",
          "sha256": "169356d4c8c47f983f57dbd17739d2c2c915f16cc8dd5f3c642660f7687364d0",
          "bytes": 1909
        },
        {
          "path": "skills/market-discovery/SKILL.md",
          "sha256": "bf870d66a10279e24885293ae2fa57304475b87d090ad8e73c35be84a1743ae0",
          "bytes": 7239
        },
        {
          "path": "support.js",
          "sha256": "cc471c0ce6b82d9ce56a0b1f3bae0bdf416d4e4ab952801f27dc573cba52a509",
          "bytes": 546
        },
        {
          "path": "tools.js",
          "sha256": "4ce80fe59868fac70b514d4a127cec18b94a4413454109badf56b17d8d1b8a1f",
          "bytes": 2211
        },
        {
          "path": "tools.json",
          "sha256": "68f11cd96fdf3f86d718ee076d744cda108f955cc6df74a2235bd6cb9c194c91",
          "bytes": 23370
        }
      ]
    },
    {
      "id": "sesame/memory",
      "version": "2.0.1",
      "directory": "memory",
      "treeDigest": "sha256:062a0c37f06a21ab5ec3c21d0d48d816480dfa88b7601388f5d0fbb35e121569",
      "files": [
        {
          "path": "LICENSE",
          "sha256": "2681aaf69ad3f8a595707e154e1e065a0077db9f1d25f8f5df73c02c5657477a",
          "bytes": 1063
        },
        {
          "path": "index.js",
          "sha256": "b201e9ffdb3337da815d3b652d75098eac8767fb080ad7bb40713dffc4939419",
          "bytes": 42
        },
        {
          "path": "package.json",
          "sha256": "b398c7d55eaadde1cfb6c450c97157a5b05f010910a87f85a7c7957e17ccaef4",
          "bytes": 100
        },
        {
          "path": "plugin.json",
          "sha256": "ad23603215c892d7efd3d518a77be7113bbd0a0b65a1981776d2a2fecaa1bfe3",
          "bytes": 676
        },
        {
          "path": "prompt.md",
          "sha256": "9c73eb8cd36a014c9eb81eca5b007c09193b671a33b3d0024cd166da0584170d",
          "bytes": 2154
        },
        {
          "path": "skills/manage-memory/SKILL.md",
          "sha256": "74e75082808fc94b23f72c848dc794d63bc4d6ff8dfc46b2e1c43e0e79a792bf",
          "bytes": 2961
        },
        {
          "path": "support.js",
          "sha256": "cc471c0ce6b82d9ce56a0b1f3bae0bdf416d4e4ab952801f27dc573cba52a509",
          "bytes": 546
        },
        {
          "path": "tools.js",
          "sha256": "10528d2529e5d06df852d1f333c2b55edaa796f867b515c995ed6bba75b83459",
          "bytes": 4607
        },
        {
          "path": "tools.json",
          "sha256": "56a7d045b176c7f1cac661dbe334fef5dca1929978857b045539e25e414f69cb",
          "bytes": 18480
        }
      ]
    },
    {
      "id": "sesame/orchestration",
      "version": "2.2.1",
      "directory": "orchestration",
      "treeDigest": "sha256:8f05fabdbee659fb414c8ce82d6849713a1c7e738df7c06dd1b5b411714b3bfa",
      "files": [
        {
          "path": "LICENSE",
          "sha256": "2681aaf69ad3f8a595707e154e1e065a0077db9f1d25f8f5df73c02c5657477a",
          "bytes": 1063
        },
        {
          "path": "index.js",
          "sha256": "b201e9ffdb3337da815d3b652d75098eac8767fb080ad7bb40713dffc4939419",
          "bytes": 42
        },
        {
          "path": "package.json",
          "sha256": "f8ea5f54a5325020d2d6380722d88e72ea83eb6f31322241fbf9c5fe7b3e1ec0",
          "bytes": 107
        },
        {
          "path": "plugin.json",
          "sha256": "0a41be4791d39f98d0529ed947829cfd1e216162fb36f2b6741ecdc434b5d327",
          "bytes": 1022
        },
        {
          "path": "prompt.md",
          "sha256": "c1fbe5f1c4d5bd2d41a7a1a5180fb2e9c56f7487a742796db3c91b4b31bdb988",
          "bytes": 7671
        },
        {
          "path": "skills/sesame-user-guide/SKILL.md",
          "sha256": "d7fd3585de3086e33a6dc7300e128227df7e6574a7fbbae2a1212e5ad66c34a3",
          "bytes": 4106
        },
        {
          "path": "skills/sesame-user-guide/references/chat-and-commands.md",
          "sha256": "43a9bafaaaed64f2b1a4e2a7ea1c04192cc04091b97e27a2e6e4fcfe472c5726",
          "bytes": 5703
        },
        {
          "path": "skills/sesame-user-guide/references/dashboard.md",
          "sha256": "43a014a55b7c30cabb4645c1b2fead8cd8237edf0909beaf7ec4b16d803d1174",
          "bytes": 6703